id,category,language,question,answer
1149,CATEGORY 3 — TOURIST ATTRACTIONS,Tamil,சுற்றுலா இடங்களில் ஓய்வு நேரம் எடுத்துக்கொள்வது ஏன் அவசியம்?,சோர்வை குறைத்து பயண அனுபவத்தை மேம்படுத்த.
1150,CATEGORY 3 — TOURIST ATTRACTIONS,Tamil,சுற்றுலா இடங்களை பொறுப்புடன் பார்வையிடுவது ஏன் முக்கியம்?,இயற்கையும் பண்பாட்டும் நீடித்து பாதுகாக்கப்படுவதற்காக.
1151,CATEGORY 4 — FOOD & CULTURE,Tamil,இலங்கையின் பாரம்பரிய உணவுகள் எவை?,"சாதம், கறிகள், சம்பல் வகைகள் மற்றும் பாரம்பரிய இனிப்புகள்."
1152,CATEGORY 4 — FOOD & CULTURE,Tamil,இலங்கை உணவுகள் ஏன் காரமாக இருப்பதாக கருதப்படுகின்றன?,மசாலா வகைகள் மற்றும் காரச் சுவை அதிகமாக பயன்படுத்தப்படுவதால்.
1153,CATEGORY 4 — FOOD & CULTURE,Tamil,பாரம்பரிய இனிப்புகள் இலங்கை பண்பாட்டில் ஏன் முக்கியம்?,விழாக்கள் மற்றும் சிறப்பு நிகழ்வுகளில் அவை முக்கிய பங்கு வகிப்பதால்.
1154,CATEGORY 4 — FOOD & CULTURE,Tamil,இலங்கை உணவுகளில் தேங்காய் பயன்பாடு ஏன் அதிகமாக உள்ளது?,தேங்காய் சுவையும் ஊட்டச்சத்தும் அதிகம் கொண்டதால்.
1155,CATEGORY 4 — FOOD & CULTURE,Tamil,சைவ உணவுகள் இலங்கையில் எவ்வளவு பிரபலமாக உள்ளன?,மத மற்றும் பண்பாட்டு காரணங்களால் பல பகுதிகளில் பரவலாக உள்ளது.
1156,CATEGORY 4 — FOOD & CULTURE,Tamil,தெரு உணவுகள் சுற்றுலாப்பயணிகளிடம் ஏன் பிரபலமாக உள்ளன?,"குறைந்த விலை, புதிய சுவை மற்றும் உள்ளூர் அனுபவம் வழங்குவதால்."
1157,CATEGORY 4 — FOOD & CULTURE,Tamil,உணவு சாப்பிடும்போது உள்ளூர் பழக்கங்களை மதிப்பது ஏன் அவசியம்?,பண்பாட்டு மரியாதையை காட்டவும் தவறான புரிதல்களைத் தவிர்க்கவும்.
1158,CATEGORY 4 — FOOD & CULTURE,Tamil,இலங்கை உணவுகளில் அரிசியின் முக்கியத்துவம் என்ன?,அரிசி முக்கிய உணவாக இருந்து பல உணவுகளின் அடிப்படையாக உள்ளது.
1159,CATEGORY 4 — FOOD & CULTURE,Tamil,பாரம்பரிய உணவுகள் எப்போது பொதுவாக தயாரிக்கப்படுகின்றன?,"பண்டிகைகள், திருமணங்கள் மற்றும் குடும்ப விழாக்களில்."
1160,CATEGORY 4 — FOOD & CULTURE,Tamil,இலங்கை உணவுகளில் மசாலா கலவைகள் ஏன் பயன்படுத்தப்படுகின்றன?,"சுவை, வாசனை மற்றும் உணவின் தனித்துவத்தை அதிகரிக்க."
1161,CATEGORY 4 — FOOD & CULTURE,Tamil,உணவு பரிமாறும் முறைகள் பண்பாட்டை எவ்வாறு பிரதிபலிக்கின்றன?,"மரியாதை, பகிர்வு மற்றும் சமூக ஒற்றுமையை வெளிப்படுத்துவதன் மூலம்."
1162,CATEGORY 4 — FOOD & CULTURE,Tamil,இலங்கை தேநீர் பண்பாட்டில் ஏன் முக்கிய இடம் பெறுகிறது?,"வரலாறு, பொருளாதாரம் மற்றும் தினசரி வாழ்க்கையின் ஒரு பகுதியாக இருப்பதால்."
1163,CATEGORY 4 — FOOD & CULTURE,Tamil,பாரம்பரிய உணவுகள் தலைமுறை தோறும் எவ்வாறு பாதுகாக்கப்படுகின்றன?,சமையல் முறைகள் மற்றும் குடும்ப வழக்கங்கள் மூலம்.
1164,CATEGORY 4 — FOOD & CULTURE,Tamil,இலங்கை உணவுகளில் காய்கறிகள் ஏன் அதிகம் பயன்படுத்தப்படுகின்றன?,இயற்கையாக கிடைக்கும் பொருட்கள் மற்றும் ஆரோக்கிய காரணங்களால்.
1165,CATEGORY 4 — FOOD & CULTURE,Tamil,உணவு மற்றும் பண்பாடு ஒன்றுடன் ஒன்று எவ்வாறு தொடர்புடையவை?,உணவு ஒரு சமூகத்தின் வாழ்க்கை முறை மற்றும் மரபுகளை பிரதிபலிப்பதால்.
1166,CATEGORY 4 — FOOD & CULTURE,Tamil,சுற்றுலாப்பயணிகள் உள்ளூர் உணவுகளை சுவைப்பது ஏன் முக்கியம்?,அந்த நாட்டின் பண்பாட்டை உணர உதவுவதால்.
1167,CATEGORY 4 — FOOD & CULTURE,Tamil,இலங்கை உணவுகளில் காரமும் புளிப்பும் ஏன் சமநிலையில் உள்ளன?,சுவை சமநிலையை உருவாக்க பாரம்பரியமாக பயன்படுத்தப்படுவதால்.
1168,CATEGORY 4 — FOOD & CULTURE,Tamil,உணவின் வாசனை உணவு அனுபவத்தில் எவ்வாறு தாக்கம் செய்கிறது?,உணர்ச்சிகளை தூண்டி சுவை அனுபவத்தை மேம்படுத்துகிறது.
1169,CATEGORY 4 — FOOD & CULTURE,Tamil,இலங்கை பண்பாட்டில் விருந்தோம்பல் ஏன் முக்கியம்?,விருந்தினர்களை மரியாதையுடன் வரவேற்கும் பாரம்பரியம் இருப்பதால்.
1170,CATEGORY 4 — FOOD & CULTURE,Tamil,உணவுடன் தொடர்புடைய பழக்கவழக்கங்கள் எவ்வாறு உருவாகின்றன?,"வரலாறு, மதம் மற்றும் சமூக நடைமுறைகள் மூலம்."
1171,CATEGORY 4 — FOOD & CULTURE,Tamil,பாரம்பரிய சமையல் முறைகள் ஏன் பாதுகாக்கப்பட வேண்டும்?,பண்பாட்டு அடையாளத்தை காக்கும் என்பதால்.
1172,CATEGORY 4 — FOOD & CULTURE,Tamil,உணவு திருவிழாக்கள் சுற்றுலாவில் என்ன பங்கு வகிக்கின்றன?,உள்ளூர் உணவுகளை அறிமுகப்படுத்தவும் சுற்றுலாவை ஊக்குவிக்கவும்.
1173,CATEGORY 4 — FOOD & CULTURE,Tamil,உணவின் தயாரிப்பு முறைகள் பிராந்தியத்துக்கு ஏற்ப ஏன் மாறுபடுகின்றன?,கிடைக்கும் பொருட்கள் மற்றும் உள்ளூர் பழக்கங்கள் காரணமாக.
1174,CATEGORY 4 — FOOD & CULTURE,Tamil,உணவு பகிர்வு இலங்கை சமூகத்தில் ஏன் முக்கியமானது?,"ஒற்றுமை, பரிவு மற்றும் சமூக உறவை வலுப்படுத்துவதால்."
1175,CATEGORY 4 — FOOD & CULTURE,Tamil,உணவு மற்றும் விழாக்கள் இடையிலான தொடர்பு என்ன?,விழாக்களின் முக்கிய பகுதியாக உணவு இடம்பெறுவதால்.
1176,CATEGORY 4 — FOOD & CULTURE,Tamil,இலங்கை உணவுகளில் கடல் உணவுகள் ஏன் முக்கியமானவை?,கடற்கரை பகுதிகள் அதிகமாக இருப்பதால் புதிய கடல் உணவுகள் எளிதில் கிடைப்பதற்காக.
1177,CATEGORY 4 — FOOD & CULTURE,Tamil,பாரம்பரிய உணவுகள் தயாரிக்கப்படும் போது குடும்ப பங்கு ஏன் முக்கியம்?,சமையல் அறிவு தலைமுறைகளுக்கு பரிமாறப்படுவதற்காக.
1178,CATEGORY 4 — FOOD & CULTURE,Tamil,இலங்கை உணவுகளில் மசாலாவின் அளவு எவ்வாறு கட்டுப்படுத்தப்படுகிறது?,சுவை சமநிலையைப் பேண பாரம்பரிய சமையல் முறைகள் பயன்படுத்தப்படுவதால்.
1179,CATEGORY 4 — FOOD & CULTURE,Tamil,இலங்கை இனிப்புகள் சுற்றுலாப்பயணிகளிடம் ஏன் பிரபலமாக உள்ளன?,தனித்துவமான சுவை மற்றும் பாரம்பரிய தயாரிப்பு முறைகள் காரணமாக.
1180,CATEGORY 4 — FOOD & CULTURE,Tamil,உணவகங்களில் உள்ளூர் உணவுகளை தேர்வு செய்வது ஏன் பயனுள்ளது?,உண்மையான பண்பாட்டு அனுபவத்தை பெற உதவுவதால்.
1181,CATEGORY 4 — FOOD & CULTURE,Tamil,உணவு உண்ணும் நேரம் இலங்கை பண்பாட்டில் ஏன் முக்கியமானது?,குடும்ப உறுப்பினர்கள் ஒன்றாக கூடும் நேரமாக இருப்பதால்.
1182,CATEGORY 4 — FOOD & CULTURE,Tamil,இலங்கை உணவுகளில் வாழை இலை பயன்படுத்தப்படுவது ஏன்?,"இயற்கையானது, சுகாதாரமானது மற்றும் பாரம்பரியமானது என்பதால்."
1183,CATEGORY 4 — FOOD & CULTURE,Tamil,உணவு பரிமாறும் போது ஒழுக்கம் ஏன் அவசியம்?,மரியாதையையும் பண்பாட்டையும் வெளிப்படுத்துவதற்காக.
1184,CATEGORY 4 — FOOD & CULTURE,Tamil,உணவு மற்றும் மத சடங்குகள் எவ்வாறு தொடர்புடையவை?,பல மத நிகழ்வுகளில் உணவு முக்கிய இடம் பெறுவதால்.
1185,CATEGORY 4 — FOOD & CULTURE,Tamil,இலங்கை உணவுகளில் புளிப்பு சுவை எவ்வாறு பெறப்படுகிறது?,"புளி, எலுமிச்சை மற்றும் பாரம்பரிய புளிப்பு பொருட்கள் மூலம்."
1186,CATEGORY 4 — FOOD & CULTURE,Tamil,உணவின் நிறம் உணவு அனுபவத்தில் என்ன தாக்கம் செலுத்துகிறது?,உணவின் கவர்ச்சியையும் ஆசையையும் அதிகரிக்கிறது.
1187,CATEGORY 4 — FOOD & CULTURE,Tamil,இலங்கை உணவுகளில் தேங்காய் எண்ணெய் ஏன் பயன்படுத்தப்படுகிறது?,சுவை மற்றும் பாரம்பரிய சமையல் முறைகளுக்காக.
1188,CATEGORY 4 — FOOD & CULTURE,Tamil,உணவுடன் தொடர்புடைய பழமொழிகள் மற்றும் கதைகள் ஏன் முக்கியம்?,பண்பாட்டு அறிவையும் வாழ்க்கை முறையையும் வெளிப்படுத்துவதால்.
1189,CATEGORY 4 — FOOD & CULTURE,Tamil,உணவு தயாரிப்பில் பருவ கால பொருட்கள் ஏன் பயன்படுத்தப்படுகின்றன?,"புதிய தன்மை, சுவை மற்றும் ஊட்டச்சத்து அதிகமாக இருப்பதால்."
1190,CATEGORY 4 — FOOD & CULTURE,Tamil,இலங்கை உணவுகளில் இறைச்சி பயன்பாடு எவ்வாறு மாறுபடுகிறது?,மத நம்பிக்கைகள் மற்றும் பிராந்திய பழக்கங்கள் அடிப்படையில்.
1191,CATEGORY 4 — FOOD & CULTURE,Tamil,உணவு உண்ணும் போது பகிர்வு ஏன் முக்கியமாக கருதப்படுகிறது?,சமூக ஒற்றுமையும் பரிவும் வளர்க்கப்படுவதற்காக.
1192,CATEGORY 4 — FOOD & CULTURE,Tamil,பாரம்பரிய சமையல் கருவிகள் இன்னும் பயன்படுத்தப்படுவதற்கான காரணம் என்ன?,உணவின் உண்மையான சுவையை பாதுகாக்க உதவுவதால்.
1193,CATEGORY 4 — FOOD & CULTURE,Tamil,உணவின் தயாரிப்பு நேரம் ஏன் கவனிக்கப்பட வேண்டும்?,உணவின் தரமும் பாதுகாப்பும் உறுதி செய்யப்படுவதற்காக.
1194,CATEGORY 4 — FOOD & CULTURE,Tamil,இலங்கை உணவுகளில் சைவ உணவுகள் ஏன் பரவலாக உள்ளன?,மத நம்பிக்கைகள் மற்றும் பண்பாட்டு பழக்கங்கள் காரணமாக.
1195,CATEGORY 4 — FOOD & CULTURE,Tamil,உணவுடன் தொடர்புடைய இசை மற்றும் நடனம் ஏன் முக்கியம்?,விழாக்களில் மகிழ்ச்சியும் பண்பாட்டு வெளிப்பாடும் அதிகரிப்பதால்.
1196,CATEGORY 4 — FOOD & CULTURE,Tamil,உணவு வழக்கங்கள் ஒரு சமூகத்தை எவ்வாறு அடையாளப்படுத்துகின்றன?,வாழ்க்கை முறை மற்றும் பண்பாட்டு மதிப்புகளை வெளிப்படுத்துவதால்.
1197,CATEGORY 4 — FOOD & CULTURE,Tamil,உணவின் சுவை தலைமுறை தோறும் எவ்வாறு மாற்றம் அடைகிறது?,புதிய பொருட்கள் மற்றும் சமையல் முறைகள் சேர்ப்பதன் மூலம்.
1198,CATEGORY 4 — FOOD & CULTURE,Tamil,இலங்கை உணவுகளில் இயற்கை இனிப்புகள் ஏன் விரும்பப்படுகின்றன?,ஆரோக்கியமானதும் பாரம்பரியமானதும் என்பதால்.
1199,CATEGORY 4 — FOOD & CULTURE,Tamil,உணவு பண்பாடு சுற்றுலாவை எவ்வாறு ஊக்குவிக்கிறது?,பயணிகளை உள்ளூர் வாழ்க்கை முறையை அனுபவிக்க ஈர்ப்பதன் மூலம்.
1200,CATEGORY 4 — FOOD & CULTURE,Tamil,பாரம்பரிய உணவுகளை பாதுகாப்பது ஏன் அவசியம்?,பண்பாட்டு மரபும் அடையாளமும் நீடிக்கப்படுவதற்காக.
1201,CATEGORY 5 — HOTEL SERVICES,Tamil,ஹோட்டல் சேவைகள் என்றால் என்ன?,"விருந்தினர்களுக்கு வழங்கப்படும் வசதிகள், உதவிகள் மற்றும் ஆதரவு சேவைகள் ஆகும்."
1202,CATEGORY 5 — HOTEL SERVICES,Tamil,அறை சேவை ஹோட்டலில் ஏன் முக்கியமானது?,விருந்தினர்களுக்கு வசதியும் தனியுரிமையும் வழங்குவதற்காக.
1203,CATEGORY 5 — HOTEL SERVICES,Tamil,ஹோட்டலில் வரவேற்பு மேசையின் பங்கு என்ன?,"விருந்தினர்களை பதிவு செய்தல், தகவல் வழங்கல் மற்றும் உதவி செய்வது."
1204,CATEGORY 5 — HOTEL SERVICES,Tamil,ஹோட்டலில் துப்புரவு சேவை ஏன் அவசியம்?,சுத்தமான மற்றும் ஆரோக்கியமான சூழலை உறுதி செய்வதற்காக.
1205,CATEGORY 5 — HOTEL SERVICES,Tamil,ஹோட்டல் பணியாளர்களின் நடத்தை ஏன் முக்கியம்?,விருந்தினர் அனுபவத்தை மேம்படுத்தவும் திருப்தியை அதிகரிக்கவும்.
1206,CATEGORY 5 — HOTEL SERVICES,Tamil,ஹோட்டலில் பாதுகாப்பு சேவைகள் ஏன் தேவை?,விருந்தினர்களின் பாதுகாப்பையும் சொத்துகளையும் காக்க.
1207,CATEGORY 5 — HOTEL SERVICES,Tamil,ஹோட்டலில் உணவக சேவை என்ன பயன் தருகிறது?,வசதியான முறையில் உணவு மற்றும் பானங்களை பெற உதவுகிறது.
1208,CATEGORY 5 — HOTEL SERVICES,Tamil,ஹோட்டலில் சலவை சேவை ஏன் பயனுள்ளதாக உள்ளது?,விருந்தினர்களின் உடைகள் சுத்தமாகவும் ஒழுங்காகவும் வைத்திருக்க.
1209,CATEGORY 5 — HOTEL SERVICES,Tamil,ஹோட்டலில் இணைய வசதி ஏன் அவசியம்?,"தொடர்பு, வேலை மற்றும் தகவல் தேடலுக்காக."
1210,CATEGORY 5 — HOTEL SERVICES,Tamil,ஹோட்டலில் முன்பதிவு சேவை எவ்வாறு செயல்படுகிறது?,விருந்தினர்கள் முன்கூட்டியே அறைகளை உறுதி செய்ய உதவுகிறது.
1211,CATEGORY 5 — HOTEL SERVICES,Tamil,ஹோட்டலில் வாகன நிறுத்த வசதி ஏன் முக்கியம்?,விருந்தினர்களுக்கு பாதுகாப்பான வாகன நிறுத்தத்தை வழங்க.
1212,CATEGORY 5 — HOTEL SERVICES,Tamil,ஹோட்டலில் குழந்தைகளுக்கான சேவைகள் உள்ளதா?,சில ஹோட்டல்களில் குழந்தைகளுக்கான சிறப்பு சேவைகள் வழங்கப்படுகின்றன.
1213,CATEGORY 5 — HOTEL SERVICES,Tamil,ஹோட்டலில் மாற்றுத் திறனாளிகளுக்கான வசதிகள் ஏன் அவசியம்?,அனைவருக்கும் சமமான அணுகலை உறுதி செய்வதற்காக.
1214,CATEGORY 5 — HOTEL SERVICES,Tamil,ஹோட்டலில் அவசர சேவைகள் ஏன் முக்கியம்?,எதிர்பாராத சூழ்நிலைகளில் உடனடி உதவி வழங்க.
1215,CATEGORY 5 — HOTEL SERVICES,Tamil,ஹோட்டலில் விருந்தினர் புகார்கள் எவ்வாறு கையாளப்படுகின்றன?,உடனடி கவனத்துடன் தீர்வு வழங்குவதன் மூலம்.
1216,CATEGORY 5 — HOTEL SERVICES,Tamil,ஹோட்டலில் அறை பராமரிப்பு ஏன் அவசியம்?,வசதியான மற்றும் பாதுகாப்பான தங்குதலை உறுதி செய்ய.
1217,CATEGORY 5 — HOTEL SERVICES,Tamil,ஹோட்டலில் பயண தகவல் சேவைகள் உள்ளனவா?,பல ஹோட்டல்களில் சுற்றுலா தகவல் மற்றும் வழிகாட்டல் வழங்கப்படுகிறது.
1218,CATEGORY 5 — HOTEL SERVICES,Tamil,ஹோட்டலில் நேர மேலாண்மை ஏன் முக்கியம்?,சேவைகள் தாமதமின்றி வழங்கப்படுவதற்காக.
1219,CATEGORY 5 — HOTEL SERVICES,Tamil,ஹோட்டலில் விருந்தினர்களின் தனியுரிமை ஏன் முக்கியம்?,நம்பிக்கை மற்றும் திருப்தியை பேணுவதற்காக.
1220,CATEGORY 5 — HOTEL SERVICES,Tamil,ஹோட்டலில் விருந்தினர் பாதுகாப்பு எவ்வாறு உறுதி செய்யப்படுகிறது?,"பாதுகாப்பு பணியாளர்கள், கண்காணிப்பு அமைப்புகள் மற்றும் விதிமுறைகள் மூலம்."
1221,CATEGORY 5 — HOTEL SERVICES,Tamil,ஹோட்டலில் அறை மாற்றம் செய்ய முடியுமா?,கிடைப்பதன் அடிப்படையில் சில ஹோட்டல்களில் அனுமதிக்கப்படுகிறது.
1222,CATEGORY 5 — HOTEL SERVICES,Tamil,ஹோட்டலில் கூடுதல் சேவைகளுக்கு கட்டணம் வசூலிக்கப்படுமா?,சில சேவைகளுக்கு கூடுதல் கட்டணம் விதிக்கப்படலாம்.
1223,CATEGORY 5 — HOTEL SERVICES,Tamil,ஹோட்டலில் சேவை தரத்தை எவ்வாறு மேம்படுத்தலாம்?,பணியாளர்களின் பயிற்சி மற்றும் விருந்தினர் கருத்துகள் மூலம்.
1224,CATEGORY 5 — HOTEL SERVICES,Tamil,ஹோட்டலில் சுற்றுச்சூழல் நட்பு சேவைகள் உள்ளனவா?,சில ஹோட்டல்கள் சுற்றுச்சூழலை பாதுகாக்கும் சேவைகளை வழங்குகின்றன.
1225,CATEGORY 5 — HOTEL SERVICES,Tamil,ஹோட்டலில் விருந்தினர் கருத்துகளை சேகரிப்பது ஏன் முக்கியம்?,சேவைகளை மேம்படுத்தவும் எதிர்கால விருந்தினர்களுக்கு உதவவும்.
