id,category,language,question,answer
573,CATEGORY 2 — TRANSPORTATION,Sinhala,දුම්රිය ගමන් සඳහා කුඩා දරුවන්ට අවශ්‍ය පහසුකම් තිබේද?,"ඇත, දෙපාර්ශවික બેઠක, ළදරුවන් සදහා නිවාසිතාකරණය සහ ආරක්ෂිත බෑග් තැන්පත් ස්ථාන ඇත."
574,CATEGORY 2 — TRANSPORTATION,Sinhala,ගමන් අතරතුර මාර්ගය පිළිබඳ වරදක් සිදු වුවහොත් මට කළ යුතු වන්නේ කුමක්ද?,මඟපෙන්වීම සඳහා රියදුරා හෝ ප්‍රවාහන සේවකයින්ගෙන් උපදෙස් ලබාගත යුතුය.
575,CATEGORY 2 — TRANSPORTATION,Sinhala,බස් හෝ දුම්රිය පුරප්පාඩුවක් ඇති විට පෝලිමක ඉන්නා අයගේ අයිතිවාසිකම් මොනවාද?,පළමුව සිටින අයවලට උසස් ප්‍රාථමිකත්වය තිබේ; නීති රීති පිළිපදිය යුතුයි.
576,CATEGORY 2 — TRANSPORTATION,Sinhala,උසස් මාර්ගවල ගමන් කිරීමේදී අවදානම් මොනවාද?,"වාහන වේගය, ඇද හැලෙන මාර්ග සහ අඩු දැක්ම අවදානම් බවක් ඇත."
577,CATEGORY 2 — TRANSPORTATION,Sinhala,ගමන් මඟින් භූ දර්ශන නරඹන්නට අවස්ථා තිබේද?,"ඔව්, බස් හා දුම්රිය මාර්ග බොහොමයක් ස්වභාවික දසුන් මත ගමන් කරයි."
578,CATEGORY 2 — TRANSPORTATION,Sinhala,නගර තුළ කෙටි දුර ගමන් කිරීම සඳහා හොඳම මාර්ගය කුමක්ද?,ත්‍රිචක්‍ර වාහන හෝ නගර බස් භාවිතා කිරීම යෝග්‍ය වේ.
579,CATEGORY 2 — TRANSPORTATION,Sinhala,දුම්රියට නැගීමේදී නිතර ඇතිවන අවදානම් මොනවාද?,"දුවගෙන දුම්රියට නැගීම, දොරකඩ අසුරේ පීඩනය, සහ බෑග් වැටීම."
580,CATEGORY 2 — TRANSPORTATION,Sinhala,මාර්ගය හඳුනාගැනීමේදී ප්‍රදේශීය ජනතාවගෙන් උපදෙස් ලබාගත හැකිද?,"ඔව්, බොහෝ දෙනා කරුණාවෙන් මඟ පෙන්වීමේ උපකාර ලබා දෙති."
581,CATEGORY 2 — TRANSPORTATION,Sinhala,ගමන් අතරතුර ගබඩා බෑග් සුරක්ෂිතව තැබිය හැක්කේ කෙසේද?,"අතට ලඟින් තැබීම, දුම්රිය/බස් තුළ නියමිත බෑග් තැන්පත් ස්ථාන භාවිතා කිරීම, හෝ වැසී ඇති බෑග් භාවිතා කිරීම යෝග්‍ය වේ."
582,CATEGORY 2 — TRANSPORTATION,Sinhala,දුම්රිය මඟින් දිගු ගමන් කරන විට වතුර හා ආහාර ගෙන යාම වැදගත්ද?,"ඔව්, දිගු ගමන් සඳහා පානය සහ කුඩා ආහාර ලබාගැනීම සඳහා පෙර සූදානම් වීම වැදගත්ය."
583,CATEGORY 2 — TRANSPORTATION,Sinhala,නගර බස්වල ගමන් කිරීමේදී අනතුරු වැළැක්වීමේ ක්‍රම මොනවාද?,"දොරකඩ ඉසව්වෙන් වෙන්ව සිටීම, වස්තූන් හොඳින් තබා ගැනීම, සහ ගමන් අතරතුර ඉදිරිපසට නොමැදීම."
584,CATEGORY 2 — TRANSPORTATION,Sinhala,දුම්රිය ගමන් සඳහා වාරික ගාස්තු වෙනස් වන්නේ කෙසේද?,"දුර, ආසන වර්ගය, සහ ගමන් මාර්ගය අනුව ගාස්තු වෙනස් වේ."
585,CATEGORY 2 — TRANSPORTATION,Sinhala,මගෙ බෑග් දුම්රිය තුළ අහිමි වුවහොත් මට කළ යුතු වන්නේ කුමක්ද?,"දුම්රිය සේවකයින්ට වහාම දන්වා, අහිමි වීම පිළිබඳ ලේඛනයක් සකස් කළ යුතුය."
586,CATEGORY 2 — TRANSPORTATION,Sinhala,ගමන් මාර්ගය මාරු කිරීමට ලඟ ප්‍රදේශවල මාර්ග පුවරු තිබේද?,බොහෝ ප්‍රදේශවල දුම්රිය ස්ථාන සහ මධ්‍යස්ථාන තුළ මාර්ග පුවරු සවි කර ඇත.
587,CATEGORY 2 — TRANSPORTATION,Sinhala,බස් කාලසටහන නිවැරදිව ක්‍රියා නොකළහොත් මට මඟපෙන්වීමක් ලබාගත හැක්කේ කෙසේද?,ප්‍රවාහන සේවකයින්ගෙන් හෝ අසල ජනතාවගෙන් උපදෙස් ලබාගත හැක.
588,CATEGORY 2 — TRANSPORTATION,Sinhala,උද්ඝෝෂණ හෝ ගැඹුරු මෝටර් ශබ්ද අසනීප කරන්නේද?,"සමහර වෙලාවන්දී ලෝකයේ ගමන් රථවල ශබ්ද වැඩි විය හැකි බැවින්, ඉවසිලි හා නීතිගරුක භාවයක් පැවති යුතුය."
589,CATEGORY 2 — TRANSPORTATION,Sinhala,"ගමන් අතරතුර නාසි රෝග, දැවිල්ල ආදී අපහසුතා වලට ප්‍රතිකාර ගත හැක්කේ කෙසේද?","මූලික ප්‍රථමාධාර සගවනු ලැබුවහොත් ඒවා භාවිතා කළ යුතුය, නැතහොත් ළඟම ඇති වෛද්‍ය මධ්‍යස්ථානයෙන් උපදෙස් ලබාගත හැක."
590,CATEGORY 2 — TRANSPORTATION,Sinhala,දුම්රිය ස්ථානය තුළ මාර්ගය හඳුනාගැනීමේ පහසු ක්‍රම කුමක්ද?,"ස්ථානයේ පුවරු, මාර්ග සංඛ්‍යාංක, සහ සේවකයින්ගෙන් ලබාගත හැකි තොරතුරු පරීක්ෂා කිරීම."
591,CATEGORY 2 — TRANSPORTATION,Sinhala,බස් රථයට නැගීමට පෙර ආරක්ෂාව සඳහා මට කළ යුත්තේ කුමක්ද?,"නවත්වන ස්ථානයේ ඉදිරියෙන් සිටීම, ගමන් පත්‍රයට අවශ්‍ය මුදල සූදානම් කරගෙන සිටීම, සහ වස්තූන් හොඳින් රඳවා ගැනීම."
592,CATEGORY 2 — TRANSPORTATION,Sinhala,ගමන් අතරතුර විවේක ස්ථාන තිබේද?,දීර්ඝ ගමන් මාර්ගවල විවේක ගැනීමට නියමිත ස්ථාන ඇත.
593,CATEGORY 2 — TRANSPORTATION,Sinhala,බස් හෝ දුම්රිය ගමන් අතරේ මාර්ගය අහිමි වුවහොත් මට කළ යුතු වන්නේ කුමක්ද?,"නිකමට එළියට නොයා, ප්‍රවාහන සේවකයෙකු හෝ රියදුරෙකුගෙන් මඟපෙන්වීම ලබාගත යුතුය."
594,CATEGORY 2 — TRANSPORTATION,Sinhala,දුම්රිය ස්ථානය තුළ ආරක්ෂාව කෙසේ තහවුරු කරයිද?,"පුවරු හා සන්නිවේදන මඟින් ආරක්ෂක නියමයින් ප්‍රකාශ කර ඇති අතර, කළමනාකරණය මගින් අවශ්‍ය පියවර ගනී."
595,CATEGORY 2 — TRANSPORTATION,Sinhala,නගර බස්වල වැඩි පිරිසක් හේතුවෙන් ඇතිවන බහුගණන අවදානම් මොනවාද?,"තැන්පත් පීඩනය, වස්තූන් අහිමි වීම, සහ පාර මාරු අවස්ථාවේ අනතුරුවලට ලක් වීම."
596,CATEGORY 2 — TRANSPORTATION,Sinhala,ගබඩා බෑග් බස් තුළ නැගෙන තැනක හෝ වැටිණහොත් මට කුමක් කළ යුතුද?,"බස් පරීක්ෂකයාට දන්වා, අවශ්‍ය නම් පසුපස ඇති විශ්‍රාම ස්ථානයකදී බෑග් ලබාගත හැක."
597,CATEGORY 2 — TRANSPORTATION,Sinhala,දුම්රිය මඟින් ගමන් කරන අතරතුර දොරකඩ අසුරේ සිටීම ආපදාදායකද?,"ඔව්, දොර අසුරේ සිටීම ඉතාමත් අනතුරුදායක බැවින් එය වළක්විය යුතුය."
598,CATEGORY 2 — TRANSPORTATION,Sinhala,නගර තුළ ත්‍රිචක්‍ර වාහනයක් භාවිතා කිරීමේදී ගාස්තු වැඩි වන්නේ කුමක් නිසාද?,"දුර, වේලාව, හා මාර්ග තදබදය අනුව ගාස්තු වෙනස් වේ."
599,CATEGORY 2 — TRANSPORTATION,Sinhala,ගමන් අතරතුර මාවත හඳුනාගැනීමට දුෂ්කර වුවහොත් මාවත සොයාගැනීමේ උතුර මොනවාද?,ප්‍රදේශයේ ජනතාවගෙන් උපදෙස් ලබාගැනීම හෝ මාර්ග සටහන පරීක්ෂා කිරීම.
600,CATEGORY 2 — TRANSPORTATION,Sinhala,ගමන් අතරතුර ආරක්ෂාවට අනුගමනය කළ යුතු මූලික නියමයන් මොනවාද?,"පුද්ගලික බෑග් ආරක්ෂා කිරීම, නවත්වන ස්ථානවල ප්‍රවේශ-නික්මීම් නීති පිළිපදිම, සහ ජනයා වැඩි ප්‍රදේශවලින් ගමන් කිරීම."
601,CATEGORY 3 — TOURIST ATTRACTIONS,Sinhala,ශ්‍රී ලංකාවේ වැඩි ජනප්‍රිය සංචාරක ස්ථාන මොනවාද?,"සීගිරිය, දළදා මාළිගාව, ගාලු කෝට්‌ටේ, යාල වනාන්තරය, එල්ල වතු කඳුකරය වැනි ස්ථාන බොහෝ ජනප්‍රියය."
602,CATEGORY 3 — TOURIST ATTRACTIONS,Sinhala,සීගිරිය බලකොටුව විශේෂත්වය කුමක්ද?,"සීගිරිය උස් කඳුකරයක් මැද ඇති බිත්ති සෙවෙල්, සිත් බැඳගන්නා සිතිජ දසුන් සහ ඉතාමත් පුරාණ ඉදිකිරීම් සම්ප්‍රදාය නිසා විශේෂත්වය ලැබේ."
603,CATEGORY 3 — TOURIST ATTRACTIONS,Sinhala,දළදා මාළිගාවට ගමන් කරන විට අනුගමනය කළ යුතු නීති මොනවාද?,"සුදුසු ඇඳුම් ධර කිරීම, මන්දගාමී හැසිරීම, සහ පූජා පිළිවෙත් ගරු කිරීම අත්‍යවශ්‍යය."
604,CATEGORY 3 — TOURIST ATTRACTIONS,Sinhala,යාල වනාන්තරයේ දෘශ්‍යාවලියේ බලාපොරොත්තු කළ හැක්කේ කුමක්ද?,"සිංහ,දීප,අලියන්,වල්කොටු සහ විවිධ පක්ෂී අතර වන සත්වයින් නිරීක්ෂණය කළ හැක."
605,CATEGORY 3 — TOURIST ATTRACTIONS,Sinhala,ගාලු කෝට්ටේ කොළඹට වඩා වෙනස් කරන්නේ කුමක්ද?,"එහි පුරාණ ඓතිහාසික තැනුම්, පාරිසරික නිශ්ශබ්දතාවය සහ විශේෂ සම්ප්‍රදායන් ගාලු කෝට්ටේ වෙනස් කරයි."
606,CATEGORY 3 — TOURIST ATTRACTIONS,Sinhala,නුවරඑළිය සංචාරය සඳහා සුදුසු කාලය කුමක්ද?,සැහැල්ලු වසන්ත සහ උණුසුම් කාලය අතර නුවරඑළිය සංචාරකයන්ට විශේෂ ලෙස සුදුසු වේ.
607,CATEGORY 3 — TOURIST ATTRACTIONS,Sinhala,හෝර්ටන් තැන්නේ “දෙවියන්ගේ මුළුතැන්ගෙය” ලෙස හැඳින්වෙන්නේ මන්ද?,"එහි උස්බැසියාවේ විවෘත දසුන්, උසස් කඳුකර පරිසරය සහ අසිරිමත් දහඩිය නිසා එයට එම නාමය ලැබී ඇත."
608,CATEGORY 3 — TOURIST ATTRACTIONS,Sinhala,සීගිරියේ අර්ධමාලාවේ බිත්තියේ විඹුල්චිත කන්‍යා නිරූපණ වල වටිනාකම කුමක්ද?,"ඒවා පුරාණ චිත්‍ර ඉදිකිරීම්, ශිල්ප සම්ප්‍රදාය සහ පුරාණ රජකාල සම්ප්‍රදායන් සම්බන්ධව ඉතා වටිනා සාක්ෂි වේ."
609,CATEGORY 3 — TOURIST ATTRACTIONS,Sinhala,දඹුල්ල රජමහා විහාරයේ විශේෂත්වය කුමක්ද?,"ගල් ගුහා තුළ පිහිටි බුද්ධ ප්‍රතිමා, බිතු සිතුවිලි සහ ඉතා පුරාණ ගුහා අභ්‍යන්තර සැලසුම් නිසා එය විශිෂ්ටයි."
610,CATEGORY 3 — TOURIST ATTRACTIONS,Sinhala,අනුරාධපුරයේ සංචාරය සඳහා කාලයක් වෙන් කළ යුතුද?,"ඔව්, අනුරාධපුරයේ විශාල පූජා ස්ථාන සහ පුරාණ නාගරික ඉතිහාස අධ්‍යයනය කිරීමට දිනයක් හෝ දෙකක් අවශ්‍ය වේ."
611,CATEGORY 3 — TOURIST ATTRACTIONS,Sinhala,පොළොන්නරුව නගරයේ පුරාණ ඉතිහාසික වටිනාකම කුමක්ද?,"පුරාණ සිංහල රජවරුන්ගේ ඉදිකිරීම්, විහාර, මඳිර හා වච්චල රූප සම්ප්‍රදායන් එහි ප්‍රමුඛ පුරාවිද්‍යාත්මක වටිනාකම වේ."
612,CATEGORY 3 — TOURIST ATTRACTIONS,Sinhala,මිරිස්ස වෙරළ තීරයේ ජනප්‍රියත්වය ලබාදෙන්නේ කුමක්ද?,"පැහැදිලි ජලය, සෙල්පකමට සුදුසු වන දියවල්, සහ මාලදිවියේ සමාන දසුන් එහි ජනප්‍රියත්වය වැඩි කරයි."
613,CATEGORY 3 — TOURIST ATTRACTIONS,Sinhala,ඇහැළියගල නාමය ලැබීමට හේතු වූ විශේෂත්වය කුමක්ද?,"ඉතා අද්විතීය ගල් කඳුස්තාන, දරුවන්ට හා පරිසරාත්මක අධ්‍යාපනයට සුදුසු ස්ථාන සහ පුරාණ කථා සම්බන්ධයයි."
614,CATEGORY 3 — TOURIST ATTRACTIONS,Sinhala,සීතා අමළතුරුමන මිථ්‍යාව සමඟ සම්බන්ධ ස්ථාන තිබේද?,"ඔව්, නුවරඑළිය ප්‍රදේශයේ විවිධ ස්ථාන රාමයණ කතාව සමඟ සම්බන්ධ බව සඳහන් කරයි."
615,CATEGORY 3 — TOURIST ATTRACTIONS,Sinhala,කතරගම මන්දිරයට ගමන් කරන සංචාරකයින් බොහෝ දෙනෙකු ඇයි?,"ආගමික විශ්වාස, උත්සව, පූජා හා රැස්වීම් නිසා කතරගම බොහෝ දෙනාගේ විශ්වාස කේන්ද්‍රයයි."
616,CATEGORY 3 — TOURIST ATTRACTIONS,Sinhala,පින්නවල විහාරයේ පාරිසරික සෞන්දර්යය ගැන කුමක් කියාගත හැක?,"සෙරුණු වනාන්තර පරිසරය, පුරාවිද්‍යාත්මක වටිනාකම සහ නිශ්ශබ්ද පරිසරය එහි සුවදායකත්වය වැඩි කරයි."
617,CATEGORY 3 — TOURIST ATTRACTIONS,Sinhala,උඩවලව වනාන්තරයේ පශු නිරීක්ෂණය සඳහා සුදුසු කාලය කුමක්ද?,උණුසුම් කාලවල උදෑසන හා සැන්දෑවේ සත්ව නිරීක්ෂණය සඳහා වඩාත් සුදුසු වේ.
618,CATEGORY 3 — TOURIST ATTRACTIONS,Sinhala,නකල්ස් කඳුකරයට ගමන් කරන අයට අවශ්‍ය කුමන මූලික දෑ තිබිය යුතුද?,"සුදුසු ඇඳුම්, පානය, ආහාර, හා භූසම්භවික ප්‍රදේශවල ගමන් කිරීම සඳහා උපකරණ."
619,CATEGORY 3 — TOURIST ATTRACTIONS,Sinhala,නුවරඑළිය බෙද රේසන් මාලිගාවේ විශේෂත්වය කුමක්ද?,"එහි ඉංග්‍රීසි ආරංචි විලාසිතාව, උද්‍යාන සැලසුම් හා පුරාණ කලා සම්ප්‍රදාය එය විශිෂ්ට කරයි."
620,CATEGORY 3 — TOURIST ATTRACTIONS,Sinhala,කන්ද වෙලී ඔර ඔර අසිරිමත් දසුන් නරඹන්නට හොඳ අවස්ථා මොනවාද?,උදෑසන සහ සැන්දෑව යන කාලය තුළ අවුරුදු සැරයක් පුරා විශාල දසුන් බැලිය හැක.
621,CATEGORY 3 — TOURIST ATTRACTIONS,Sinhala,ශ්‍රී පාද ස්ථානයට ගමන් කිරීමේ විශේෂත්වය කුමක්ද?,"ආගමික ගෞරවය, උසස් කඳුකර ගමන සහ විශාල ජනාවාස රැස්වීම් ඒ මගෙ විශේෂත්වය වේ."
622,CATEGORY 3 — TOURIST ATTRACTIONS,Sinhala,ගාල්ලේ හෙට්ටිපොළ ආසන්නයේ මහා වාණිජ කලාපය පිළිබඳ විස්තර කුමක්ද?,"එය අත්දැකීම් ගලපන වෙළෙඳ වෙළඳාම්, කලා, අතිෂ්ඨාන සෙවුම් ඇති ස්ථානයකි."
623,CATEGORY 3 — TOURIST ATTRACTIONS,Sinhala,හින්ත්ලන්ද බස්නාහිර පළාත් කාන්තා දළදා මංගල්‍යය පිළිබඳ විස්තර කුමක්ද?,එය පුරාණ ආගමික සම්ප්‍රදායන් හා ජනමාධ්‍යාත්මක උත්සව සම්බන්ධ උත්සවයකි.
624,CATEGORY 3 — TOURIST ATTRACTIONS,Sinhala,උඩවත්ත කෑලියේ පරිසර සෞන්දර්යය කෙසේ විස්තර කළ හැක?,"සෙරුණු වනාන්තරය, විශිෂ්ට පක්ෂී විවිධත්වය, හා නිශ්ශබ්ද පරිසරය එයට අලංකාර ලැබේ."
625,CATEGORY 3 — TOURIST ATTRACTIONS,Sinhala,රිදියගම සෞරාශ්‍රමය විශේෂ වන්නේ මන්ද?,"විශේෂ සත්ව පෝෂණ ක්‍රම, විශාල සෞරාශ්‍රම බලපෑම්, හා සුරක්ෂිත පරිසරයකේ සතුන් නිරීක්ෂණය කළ හැක."
626,CATEGORY 3 — TOURIST ATTRACTIONS,Sinhala,ලංකාවේ වෙරළ තීර සංචාරය සඳහා ජනප්‍රිය ප්‍රදේශ මොනවාද?,"උණවටුනා, මිරිස්ස, හිකඩුව, පිටුවල, ත්‍රිකුණාමලය වැනි වෙරළ තීර බොහෝ දෙනාගේ පොදුර වේ."
627,CATEGORY 3 — TOURIST ATTRACTIONS,Sinhala,සීගිරියට නැඟීම අවදානම්ද?,"පියසැරීම් ඉඩවල් අපහසු විය හැකි බැවින් සැලකිලිමත් වීම අවශ්‍යය, නමුත් නියමිත මාර්ග අනුගමනය කළහොත් යෝග්‍ය වේ."
628,CATEGORY 3 — TOURIST ATTRACTIONS,Sinhala,රිදියගම සොරවනයට ගිය විට සතුන් නිරීක්ෂණය සඳහා මොනවා සූදානම් කළ යුතුද?,"හොඳ දැක්මක් ඇති කැමරාව, සුදුසු ඇඳුම්, පානය, හා සෙරුණු වැසි ආවරණය ගෙන යාම වඩාත් සුදුසුය."
629,CATEGORY 3 — TOURIST ATTRACTIONS,Sinhala,උඩවල්ලව වනයේ පාරිසරික දූෂණය අවම කරගැනීමට සංචාරකයින් කළ යුතු දෑ මොනවාද?,"අපද්‍රව්‍ය දමා නොයෑම, සත්වයන්ට ආහාර නොදීම, සහ නියමිත මාර්ගවලින් නොවළක්වී ගමන් කිරීම."
630,CATEGORY 3 — TOURIST ATTRACTIONS,Sinhala,කිනිගල කදුඉවුරට නැඟීම සඳහා කාලයක් වෙන් කළ යුතුද?,නැඟීමේ දුෂ්කරතාව සහ කාලය අනුව පැය 1–2ක පමණ සූදානම් වීම සුදුසුය.
631,CATEGORY 3 — TOURIST ATTRACTIONS,Sinhala,හබරන ප්‍රදේශයේ හස්ති සුරක්ෂිත මධ්‍යස්ථාන තිබේද?,"ඔව්, හස්ති රැකවරණ ක්‍රියාකාරකම් සහ නිරීක්ෂණ කේන්ද්‍ර කිහිපයක් එහි ඇත."
632,CATEGORY 3 — TOURIST ATTRACTIONS,Sinhala,දියතලාව ප්‍රදේශයේ සංචාරකයන්ට ප්‍රියතම දසුන් මොනවාද?,"ත්‍රිකෝණාකාර කඳුකර, විශාල වැව්, හා තෙත්භූමි පරිසරය එහි විශේෂත්වයයි."
633,CATEGORY 3 — TOURIST ATTRACTIONS,Sinhala,නුවරඑළිය උද්‍යාන පිළිබඳ විශේෂත්වය මොනවාද?,"විවිධ මල් වර්ග, නනුණු සෙරුණු පාරිසරික සැලසුම් සහ පුරාණ ඉංග්‍රීසි ගෘහ නිර්මාණ රැසක්."
634,CATEGORY 3 — TOURIST ATTRACTIONS,Sinhala,ත්‍රිකුණාමලයේ කාන්තිමත් ජලය පිළිබඳ නාමය ලැබීමට හේතු කුමක්ද?,"ඔසරු ජලය පැහැදිලි වීම, ගලායන තල්ලුබල අඩු වීම, සහ සුළු උණුසුම් තත්ත්වය නිසා එය ප්‍රසිද්ධය."
635,CATEGORY 3 — TOURIST ATTRACTIONS,Sinhala,කුරුණෑගල කදුපහන “උත්තරමෘග” ලෙස හැඳින්වෙන්නේ මන්ද?,එහි ගල් කඳු මුදුන ගුවන්සිට සුළු දුරින් බලන්නට හේතු වන අශ්ව සමාන විධිවිධාන නිසා එම නාමය ලබා ඇත.
636,CATEGORY 3 — TOURIST ATTRACTIONS,Sinhala,පිටුවල වෙරළ තීරයේ දියකඩලී ගමන් සඳහා සුදුසු කාලය කුමක්ද?,"සැහැල්ලු සුලං සහ පැහැදිලි ජලය පැවතුන කාලවල, උදෑසන හා සවස යන කාලය වඩාත් සුදුසුය."
