id,category,language,question,answer
856,"CATEGORY 8 — CULTURE, TRADITIONS & EVENTS",Sinhala,අලුත් අවුරුද්දේ සම්ප්‍රදායන්ට විශේෂත්වය ඇයි?,"සතුටුදායක පවුල් එකමුතුව, රසික සෙල්ලම්, හා සම්ප්‍රදාය පෝෂණය."
857,"CATEGORY 8 — CULTURE, TRADITIONS & EVENTS",Sinhala,පාරම්පරික නර්තනයේ සුවිශේෂත්වය මොකක්ද?,සංගීත හා ශරීර චලන සංයෝජනයෙන් දෘශ්‍ය රූපකයක් නිර්මාණය වීම.
858,"CATEGORY 8 — CULTURE, TRADITIONS & EVENTS",Sinhala,වෘත්තීය කලා (traditional crafts) වැදගත් වන්නේ මන්ද?,"උරුමය පවත්වා ගැනීම, කලාකාරයන්ගේ විවෘත්තිය, හා සංචාරක වටිනාකම."
859,"CATEGORY 8 — CULTURE, TRADITIONS & EVENTS",Sinhala,උඩරට නර්තනයට ඇති වටිනාකම මොනවාද?,"පාරම්පරික අභිමානය, ආගමික චාරිත්‍ර, හා කලාත්මක රසවින්දනය."
860,"CATEGORY 8 — CULTURE, TRADITIONS & EVENTS",Sinhala,නාදගම (traditional drumming) සම්ප්‍රදාය සුවිශේෂී වන්නේ මන්ද?,"වාදන රටා, ගෙවුම් සංගීතය, සහ උත්සව රූපකයන් සමඟ සම්බන්ධතාවය."
861,"CATEGORY 8 — CULTURE, TRADITIONS & EVENTS",Sinhala,සිංහල  පාරම්පරික ඇඳුම් වර්ග මොනවාද?,"ඔසාරි, රෙදි ආවරණ, හා පාරම්පරික සාරි රෙදි."
862,"CATEGORY 8 — CULTURE, TRADITIONS & EVENTS",Sinhala,කලා දක්නට අවශ්‍ය ප්‍රධාන උත්සව මොනවාද?,"කන්ද උත්සව, මහනුවර එසළ පෙරහර, හා උනුතුනන කලා උත්සව."
863,"CATEGORY 8 — CULTURE, TRADITIONS & EVENTS",Sinhala,පාරම්පරික නාට්‍යවේදයේ (traditional drama) සුවිශේෂත්වය මොකක්ද?,"විහිළු, ගී, නර්තන, හා ජීවමාන සජීවිකරණය එකට සම්බන්ධ වීම."
864,"CATEGORY 8 — CULTURE, TRADITIONS & EVENTS",Sinhala,සම්ප්‍රදායික සංගීතයේ වටිනාකම මොකක්ද?,"මනෝවිද්‍යාත්මක සාමය, කලාත්මක ගරුබව, හා සමාජ බහුලතාව."
865,"CATEGORY 8 — CULTURE, TRADITIONS & EVENTS",Sinhala,මහනුවර එසළ පෙරහර ජනප්‍රිය වන්නේ මන්ද?,"ඇතුන්ගේ රූපලාවණ්‍යය, බෙර නර්තන, හා ධර්මික ගරුබව නිසා."
866,"CATEGORY 8 — CULTURE, TRADITIONS & EVENTS",Sinhala,පාරම්පරික ගෙවුණු රෙදි වඩාත් වටිනා වන්නේ මන්ද?,"අතිශය කාලය, දක්ෂ කාර්යය, හා නිමාවට ලැබෙන මනරම් ආකෘති නිසා."
867,"CATEGORY 8 — CULTURE, TRADITIONS & EVENTS",Sinhala,සිංහල  පාරම්පරික විවාහ උත්සවයේ අරුමය මොකක්ද?,"සම්ප්‍රදායික ප්‍රාථමික චාරිත්‍ර, දැල් බබළන ඇඳුම්, හා වෛභවවත් ආචාර."
868,"CATEGORY 8 — CULTURE, TRADITIONS & EVENTS",Sinhala,පේරාහැළුවරු (Perahera participants)ගේ භූමිකාව මොනවාද?,"බෙර වාදකයන්, නර්තකයන්, මල් පසුබැසීම්, හා ආගමික අරමුන පෙන්වීම."
869,"CATEGORY 8 — CULTURE, TRADITIONS & EVENTS",Sinhala,පාරම්පරික ගීතවල විශේෂත්වය මොනවාද?,"සිංදුර, තාල රටා, හා සංගීත සම්ප්‍රදායන් එකට එකතු වීම."
870,"CATEGORY 8 — CULTURE, TRADITIONS & EVENTS",Sinhala,දළදා පෙරහර ශ්‍රී ලංකාවට වැදගත් වන්නේ මන්ද?,"දළදා වහන්සේගේ උරුමය රැකීම, ආගමික ගරුබව, හා සම්ප්‍රදාය දිගුකාලීනව පවත්වා ගැනීම."
871,"CATEGORY 8 — CULTURE, TRADITIONS & EVENTS",Sinhala,පාරම්පරික රසවින්දන මැදිහත් වන උත්සව මොනවාද?,"කිරි බත් උත්සව, හෝම, හා පාරම්පරික හැඳුනුම්ගත උත්සව."
872,"CATEGORY 8 — CULTURE, TRADITIONS & EVENTS",Sinhala,විශේෂ පූජා දිනයන් සදහා ඇති සම්ප්‍රදායන් මොනවාද?,"පහන්වලින් සැරසිලි, බෙදීමේ පූජා, හා ආගමික පණිවිඩ."
873,"CATEGORY 8 — CULTURE, TRADITIONS & EVENTS",Sinhala,නර්තන හා ගී සම්ප්‍රදායන් ඉගෙන ගැනීමේ වැදගත්කම මොකක්ද?,"උරුමය පවත්වා ගැනීම, යෞවන පරපුරට හඳුනාගැනීම, හා කලාකාරී හැකියාව වර්ධනය."
874,"CATEGORY 8 — CULTURE, TRADITIONS & EVENTS",Sinhala,පුරාණ කලා අභිරුචි නිර්මාණ තරගයන් වටිනා වන්නේ මන්ද?,අලුත් කලාකාරයන්ගේ දක්ශතාව ගනුදෙනුවට හෙළි කර නව සම්ප්‍රදායන් බිහිකිරීමට.
875,"CATEGORY 8 — CULTURE, TRADITIONS & EVENTS",Sinhala,ශ්‍රී ලංකාවේ මුතුහල (කාර්මික කලා අංග) සම්ප්‍රදාය සඳහන් වන්නේ කෙසේද?,"ගෙවුණු භාණ්ඩ, මැටි භාණ්ඩ, සහ පාරම්පරික හස්තාකෘති එකම තැනක පෙන්වන අංගයක් ලෙස හැඳින්වේ."
876,"CATEGORY 8 — CULTURE, TRADITIONS & EVENTS",Sinhala,පාරම්පරික කලා සැලසුම් හඳුනාගැනීමේ වැදගත්කම මොකක්ද?,"උරුමය සුරැකීම, කලාකාරයන්ගේ කෞතුකාගාරික දායකත්වය හඳුනා ගැනීම, හා සම්ප්‍රදාය පවත්වාගැනීම."
877,"CATEGORY 8 — CULTURE, TRADITIONS & EVENTS",Sinhala,සම්ප්‍රදායික කලා උපාංග සාදන කාර්ය මණ්ඩලයට ඇති වැදගත්කම මොකක්ද?,පාරම්පරික දක්ෂතා ආරක්ෂා කර පරපුරගෙන් පරපුරට විශ්වාසයෙන් මාරු කිරීමට.
878,"CATEGORY 8 — CULTURE, TRADITIONS & EVENTS",Sinhala,සම්ප්‍රදායික රුචිකර ආහාර වල වැදගත්කම මොකක්ද?,"පාරම්පරික රසවින්දනය, සමාජ උරුමය, හා කුලීට ආහාර වටිනාකම."
879,"CATEGORY 8 — CULTURE, TRADITIONS & EVENTS",Sinhala,ශ්‍රී ලංකාවේ විවිධ ප්‍රදේශවල සංස්කෘතික වෙනස්කම් පෙන්වන්නේ කෙසේද?,"භාෂාව, ඇඳුම්, උත්සව, හා ජීවන රටා අතර වෙනස්කම් මඟින්."
880,"CATEGORY 8 — CULTURE, TRADITIONS & EVENTS",Sinhala,පාරම්පරික ගෘහස්ථ උත්සවවල අරුමය මොනවාද?,"පවුල් ඒකත්වය, දෙවියන්ට ගරු කිරීම, සහ සමාජ බැඳීම ශක්තිමත් කිරීම."
881,"CATEGORY 8 — CULTURE, TRADITIONS & EVENTS",Sinhala,විශේෂ උත්සව දිනවල පාරම්පරික ඇඳුම් ధరන්නේ මන්ද?,"උරුමය ප්‍රකාශ කිරීමට, ආගමික ගරුබව පෙන්වීමට, සහ සම්ප්‍රදාය අලංකාර කිරීමට."
882,"CATEGORY 8 — CULTURE, TRADITIONS & EVENTS",Sinhala,පාරම්පරික ආචාර සැලසුම් හඳුනා ගැනීමේ වැදගත්කම මොකක්ද?,ඓතිහාසික වටිනාකම රැක ගැනීම හා අනාගත පරපුරට ප්‍රෙරාණය ලබාදීම.
883,"CATEGORY 8 — CULTURE, TRADITIONS & EVENTS",Sinhala,කලාකෘති ප්‍රදර්ශනවල අමුත්තන්ගේ උනන්දුව වැඩිවන්නේ මන්ද?,"සම්ප්‍රදායික සිතුවම්, හස්තාකෘති, හා පාරම්පරික නිමාවන් නිසා."
884,"CATEGORY 8 — CULTURE, TRADITIONS & EVENTS",Sinhala,ශ්‍රී ලංකාවේ උත්සවවලදී සංස්කෘතික රූපලාවන්‍යය පෙන්වන්නේ කෙසේද?,"දැවැන්ත පෙරහර, නර්තන, රංග කලා, හා පහන්මල් සැරසිලි මඟින්."
885,"CATEGORY 8 — CULTURE, TRADITIONS & EVENTS",Sinhala,උත්සව රැස්වීම් වලදී සම්ප්‍රදාය සුරක්ෂිතව තැබිය යුත්තේ මන්ද?,අතින් මෙනුවන පරම්පරාවන් සහ ආගමික සාමය අනාගතයට ගෙනයාම සඳහා.
886,"CATEGORY 8 — CULTURE, TRADITIONS & EVENTS",Sinhala,පුරාණ ගෙවුණු රෙදි නිමාවන්ට වටිනාකම ඇයි?,"කාලය, දක්ෂතා, හා කර්මාන්තකාරකත්වය යන අංග එකට එකතු වීම නිසා."
887,"CATEGORY 8 — CULTURE, TRADITIONS & EVENTS",Sinhala,අවුරුදු උත්සවයේ සම්ප්‍රදාය පූර්ණ ලෙස පවත්වාගෙන යාම සමාජයට හේතු මොනවාද?,"පවුල් එකමුතුව, හුරුබුහුටි සම්බන්ධතා, හා දරුවන්ට උරුමය අධ්‍යයනය."
888,"CATEGORY 8 — CULTURE, TRADITIONS & EVENTS",Sinhala,ඇඳුම් රෙදි පුණ්‍යමය උත්සවවලදී වෙනස් වන්නේ මන්ද?,"පහන්මය වර්ණ, ගරුබව පෙන්වන රෙදි, හා නීත්‍යානුකූල රෙදිපිළි."
889,"CATEGORY 8 — CULTURE, TRADITIONS & EVENTS",Sinhala,සම්ප්‍රදායික ආහාර සූදානම් කිරීමේ අරුමය මොකක්ද?,"පාරම්පරික රසවින්දනය, ධාරුෂණීය ආකාර, හා පවුල් සම්බන්ධතා ශක්තිමත් කිරීම."
890,"CATEGORY 8 — CULTURE, TRADITIONS & EVENTS",Sinhala,"පසල්, විහාර, හා දේවාල උත්සවවලදී සම්ප්‍රදායන් ගරු කිරීම වැදගත් වන්නේ මන්ද?","ආගමික ගරුබව, පිරිසිදුකම, හා සමාජ පිහිට."
891,"CATEGORY 8 — CULTURE, TRADITIONS & EVENTS",Sinhala,නර්තන හා ගී සම්ප්‍රදායන් පරපුරට මාරු කිරීම වැදගත් වන්නේ මන්ද?,උරුමය පවත්වා ගැනීම හා ආගමික/කලාත්මක විභවය අනාගතයට බෙදාහැරීම.
892,"CATEGORY 8 — CULTURE, TRADITIONS & EVENTS",Sinhala,පේරහන්වල (perahera) ඇති සවිමත් චාරිත්‍රමය අරුමය මොකක්ද?,"බෙර රටා, නර්තන රූපලාවන්‍ය, හා ආගමික සිත්සුවඳ."
893,"CATEGORY 8 — CULTURE, TRADITIONS & EVENTS",Sinhala,පූජා කටයුතු වලදී සම්ප්‍රදාය උදෙසා අනුගමනය කළ යුතු නීති මොනවාද?,"පිරිසිදුකම, සාමකාමී හැසිරීම, හා ආගමික ගරුබව රැකීම."
894,"CATEGORY 8 — CULTURE, TRADITIONS & EVENTS",Sinhala,පාරම්පරික සංගීත උත්සවවල ජනප්‍රියතාව වැඩි වන්නේ මන්ද?,"කලාත්මක විභවය, සංගීතයේ අභිමන්‍යත්වය, හා සජීවිකරණ අත්දැකීම්."
895,"CATEGORY 8 — CULTURE, TRADITIONS & EVENTS",Sinhala,සම්ප්‍රදායික ගෙවුණු භාණ්ඩ තේරීමේදී සැලකිලිමත් විය යුතු කරුණු මොනවාද?,"ගුනත්මක තත්ත්වය, නිවැරදි අලංකාරකරණය, හා පාරම්පරික රටා."
896,"CATEGORY 8 — CULTURE, TRADITIONS & EVENTS",Sinhala,උත්සව රූපලාවන්‍යය පිළිබඳ සැලකිලිමත් විය යුතු දේ මොනවාද?,"වර්ණ පරිපාලනය, සැරසිලි නීති, හා පසුබැසීමේ අරුමය."
897,"CATEGORY 8 — CULTURE, TRADITIONS & EVENTS",Sinhala,රටවල් අතර සංස්කෘතික වෙනස්කම් ඇදහැලීමට හේතු මොනවාද?,"භාෂා වෙනස්කම්, ආගමික චාරිත්‍ර, හා සමාජ ජීවන රටා වෙනස් වීම."
898,"CATEGORY 8 — CULTURE, TRADITIONS & EVENTS",Sinhala,සම්ප්‍රදායික සෙල්ලම් උත්සවවල භූමිකාව මොනවාද?,"සමාජ එකමුතුව, පවුල් සබඳතා, හා පාරම්පරික උරුමය සුරැකීම."
899,"CATEGORY 8 — CULTURE, TRADITIONS & EVENTS",Sinhala,ශ්‍රී ලංකාවේ ප්‍රදේශ අනුව උත්සවවල වෙනස්කම් පෙන්වන්නේ කෙසේද?,"ගාමිණි හා නගරාශ‍්‍රිත සම්ප්‍රදායන්, ආගමික රීති, හා පවුල් චාරිත්‍රවල වෙනස්කම් මඟින්."
900,"CATEGORY 8 — CULTURE, TRADITIONS & EVENTS",Sinhala,උත්සවවලදී අමුත්තන්ට සම්ප්‍රදාය පිළිබඳ මගපෙන්වීම වැදගත් වන්නේ මන්ද?,"නිවැරදි හැසිරීම, ගරුබව, හා ආගමික පාරම්පරාව සුරක්ෂිතව තැබීම සඳහා."
901,CATEGORY 9 — WEATHER & SEASONS,Sinhala,ශ්‍රී ලංකාවේ කාලගුණය සාරාංශයෙන් කෙසේද?,උෂ්ණ දේශීය කාලගුණයකින් සමන්විත වන අතර වියලි සහ තෙත් සමයන් ලෙස වෙන්වී ඇත.
902,CATEGORY 9 — WEATHER & SEASONS,Sinhala,වර්ෂා සමය ආරම්භ වන්නේ කෙසේද?,"තද මීහාරැල්ල, කුණු කුණාටු, සහ ඉහළ තෙතමනයක් සමඟ."
903,CATEGORY 9 — WEATHER & SEASONS,Sinhala,තද උණුසුම් දිනවල සංචාරකයන් සලකා බලන්න යුතු දේ මොනවාද?,"ප්‍රමාණවත් ජලය බොන්න, තෙත්වීමෙන් වැළැකුනු පාවහන, හා ඇඳුම් සැලසුම්."
904,CATEGORY 9 — WEATHER & SEASONS,Sinhala,වියලි සමයේ ප්‍රධාන ලක්ෂණ මොනවාද?,"අඩු වර්ෂාපතනය, ඉහළ උෂ්ණත්වය, හා පැලෑටි තෙතමනය අඩුවීම."
905,CATEGORY 9 — WEATHER & SEASONS,Sinhala,සංචාරකයන්ට සුදුසු කාලගුණය කවදාද?,සාමාන‍යයෙන් වියලි සමය — දසැම්බර් සිට අප්‍රේල් අතර කාලය.
906,CATEGORY 9 — WEATHER & SEASONS,Sinhala,වෙරළනාගර වල උණුසුම වැඩි වන්නේ මන්ද?,සූර්යාරෝහණය තද වීම සහ සමීප සාගර තරංග.
907,CATEGORY 9 — WEATHER & SEASONS,Sinhala,පර්වතදේශ වල කාලගුණය වෙනස් වන්නේ කෙසේද?,"සිසිලස දියුණු වීම, තද මීදුම, හා ඉහළ තෙතමනය."
908,CATEGORY 9 — WEATHER & SEASONS,Sinhala,පවතින සුළං රටාවන් සංචාරකයන්ට බලපාන්නේ කෙසේද?,සමහර දිනවල තරඟාත්මක සුළං හම ගමන් මග අභියෝගී කරයි.
909,CATEGORY 9 — WEATHER & SEASONS,Sinhala,වර්ෂාපතනය වැඩිවූ දිනවල මාර්ග තත්ත්වය කෙසේද?,"ගිලුණු මාර්ග, තද රදවීම, හා ඉහළ ආරක්ෂක අවදානම්."
910,CATEGORY 9 — WEATHER & SEASONS,Sinhala,විශාල වියලි කාලවලදී වනාන්තර ගිනි අවදානම් වැඩි වන්නේ මන්ද?,පළඳියාව අඩුවීම හා තද උණුසුම නිසා.
911,CATEGORY 9 — WEATHER & SEASONS,Sinhala,මීදුම වැඩි දුනයක දිස්නොවිම (visibility) අවදානම් මොනවාද?,"මාර්ග අනතුරු, ප්‍රවාහන ප්‍රමාද, හා ගමන් මග අර්බුද."
912,CATEGORY 9 — WEATHER & SEASONS,Sinhala,තද සුළං ඇති දිනයක කුමන අවදානම් ඇතිවිය හැකිද?,"කොළ ගහ වැටීම්, විදුලි කපාට ගැටලු, හා පාවහන පාලනය අසීරු වීම."
913,CATEGORY 9 — WEATHER & SEASONS,Sinhala,තද උණුසුම ඇති දිනයක විවේක සෙවීම වැදගත් වන්නේ මන්ද?,"උණුසුම්පීඩන රෝග, නිර්ජලතාව, හා ශරීර දුබලතාව වැළැක්වීමට."
914,CATEGORY 9 — WEATHER & SEASONS,Sinhala,වර්ෂා සමයේ නායයාම අවදානම් වැඩි වන්නේ මන්ද?,"අධික වර්ෂා, පස්මැටි සිරවීම, හා ගංවතුර."
915,CATEGORY 9 — WEATHER & SEASONS,Sinhala,උණුසුම් තත්ත්වය උඩු බිම් ප්‍රදේශවල අඩු වන්නේ මන්ද?,උස සහ මීදුම වැඩි නිසා.
916,CATEGORY 9 — WEATHER & SEASONS,Sinhala,සූර්ය ප්‍රකාශය වැඩි දිනවල සුරක්ෂිත ඇඳුම් පරිභෝගිකයින්ට වැදගත් වන්නේ මන්ද?,"සම දූෂණය, දග රෝග, හා තද උණුසුම් තත්ත්වයන් වැළැක්වීමට."
917,CATEGORY 9 — WEATHER & SEASONS,Sinhala,ගංගා හා වැව ප්‍රදේශවල වර්ෂා සමයේ ඇති බලපෑම් මොනවාද?,"ජල මට්ටම් ඉහළ යාම, ගංවතුර, හා වරාය සීමා මාරු වීම."
918,CATEGORY 9 — WEATHER & SEASONS,Sinhala,තද සුළං සමයේ වෙරළ ප්‍රදේශ අවදානම් බවට පත් වන්නේ මන්ද?,"තරංග උස, වැටෙන විශාල ජල ගැලිම්, සහ වෙරළ ගැටලු."
919,CATEGORY 9 — WEATHER & SEASONS,Sinhala,වියලි සමයේ දිනපතා උෂ්ණත්වය වෙනස් වන්නේ කෙසේද?,දිනපතා උණුසුම ඉහළ යාම සහ රාත්‍රී කාලයේ සිසිලස වැඩිවීම.
920,CATEGORY 9 — WEATHER & SEASONS,Sinhala,වර්ෂා සමයේ ධාවන අභ්‍යාස/බාහිර ක්‍රියාකාරකම් සීමා වන්නේ මන්ද?,"තද වැසි, මාර්ග දුර්වලතාව, හා අකාල කුණාටු."
921,CATEGORY 9 — WEATHER & SEASONS,Sinhala,වර්ෂා සමයේ සංචාරකයන් සලකා බලන්න යුතු උපදෙස් මොනවාද?,"වායු කටයුතු සැලසුම්, වතුර ඇඳුම්, හා සුරක්ෂිත මාර්ග තෝරා ගැනීම."
922,CATEGORY 9 — WEATHER & SEASONS,Sinhala,මහ කුණාටු සමයේ නාවික ගමන් නතර වන්නේ මන්ද?,"තද සුළං, උස තරංග, හා දූවිලි කුණාටු."
923,CATEGORY 9 — WEATHER & SEASONS,Sinhala,වර්ෂා සමයේ ගිනි අවදානම් අඩුවීමේ හේතුව මොකක්ද?,තෙතමනය වැඩීම සහ භූමිය තෙත් වීම.
924,CATEGORY 9 — WEATHER & SEASONS,Sinhala,වියලි සමයේ දුඹුරු දූම හා දූවිලි වැඩිවන්නේ මන්ද?,"වැසි නොගැලීම, වියලි මෘදාව, හා පවතින සුළං."
925,CATEGORY 9 — WEATHER & SEASONS,Sinhala,සංචාරකයන්ට උණුසුම් දිනවල නිතර පානීය ජලය බොන්න උපදෙස් දෙන්නේ මන්ද?,"නිර්ජලතාව, ශරීර දුර්වලතාව, හා උණුසුම් වාතය නිසා ඇතිවන සෞඛ්‍ය ගැටලු වැළැක්වීමට."
926,CATEGORY 9 — WEATHER & SEASONS,Sinhala,වියලි සමයේ පර්වත කලාපවල තත්ත්වය කෙසේ වෙනස් වෙයිද?,දිනපතා උණුසුම වැඩි වන අතර රාත්‍රී කාලයේ සිසිලස වැඩි වන ප්‍රවණතාවක් ඇත.
927,CATEGORY 9 — WEATHER & SEASONS,Sinhala,තද වැසි ඇති විට ගමන් සැලසුම් සකස් කිරීම වැදගත් වන්නේ මන්ද?,"මාර්ග ගිලීම්, ජලාපයේ වැඩිවීම, හා ප්‍රවාහන ප්‍රමාද විය හැකි බැවින්."
928,CATEGORY 9 — WEATHER & SEASONS,Sinhala,උණුසුම් දිනවල හැකි තරම් සෙවන සොයා ගැනීමට උපදෙස් දෙනේ මන්ද?,සූර්ය තැන්පතු වැඩි වීමත් සමඟ ශරීරයට අධික උණුසුමක් ලැබෙන අවදානම නිසා.
929,CATEGORY 9 — WEATHER & SEASONS,Sinhala,වර්ෂා සමයේ මුහුදු තත්ත්වය කෙසේ වෙනස් වෙයිද?,"තරංග උස, සුළං තද වීම, හා බෝට්ටු ගමන් සීමා වීම."
930,CATEGORY 9 — WEATHER & SEASONS,Sinhala,දිනපතා කාලගුණ විස්තර පරීක්ෂා කිරීම සංචාරකයන්ට වැදගත් වන්නේ මන්ද?,"උත්සව, ගමන් මාර්ග, හා බාහිර ක්‍රියාකාරකම් නිවැරදිව සැලසුම් කිරීම සඳහා."
931,CATEGORY 9 — WEATHER & SEASONS,Sinhala,වර්ෂා කාලයේ දිගු රැදවුම් (delays) ඇති වන්නේ කෙසේද?,"තද වැසි, ගංවතුර, හා මාර්ග වසා දැමීම නිසා."
932,CATEGORY 9 — WEATHER & SEASONS,Sinhala,වියලි සමයේ වායුමණ්ඩල තත්ත්වය ශරීරයට බලපාන්නේ කෙසේද?,"සම ඉලිප්ස, දුඹුරු දූම, හා විශාල උණුසුම් ගැටලු."
