id,category,language,question,answer
1,CATEGORY 1 — ACCOMMODATION,English,What types of rooms are available at this accommodation?,"We offer single, double, family, and deluxe rooms depending on your preference."
2,CATEGORY 1 — ACCOMMODATION,English,What documents do I need to check in?,A passport or national ID card is required for registration.
3,CATEGORY 1 — ACCOMMODATION,English,Does the room have hot water?,"Yes, hot water is available 24 hours a day."
4,CATEGORY 1 — ACCOMMODATION,English,Are electrical outlets suitable for charging mobile phones?,"Yes, you can charge your mobile devices using the standard outlets provided in the room."
5,CATEGORY 1 — ACCOMMODATION,English,Is food available at the accommodation?,"Yes, we provide breakfast, lunch, dinner, and a selection of local meals."
6,CATEGORY 1 — ACCOMMODATION,English,Is daily room cleaning included?,"Yes, housekeeping is provided every day to keep the room clean."
7,CATEGORY 1 — ACCOMMODATION,English,Do you have child-friendly rooms?,"Yes, we have family rooms equipped with child-safe facilities."
8,CATEGORY 1 — ACCOMMODATION,English,How far is the accommodation from the nearest town?,It is about 5 minutes to the local shops and 10 minutes to the main bus route.
9,CATEGORY 1 — ACCOMMODATION,English,Do you provide drinking water in the rooms?,"Yes, two complimentary bottles of drinking water are provided daily."
10,CATEGORY 1 — ACCOMMODATION,English,Is there an attached bathroom in the room?,"Yes, all rooms have a private bathroom with modern facilities."
11,CATEGORY 1 — ACCOMMODATION,English,What kind of view does the room offer?,"Depending on the room type, you may have views of the mountains, forest, or lake."
12,CATEGORY 1 — ACCOMMODATION,English,Is the accommodation quiet at night?,"Yes, the surrounding environment is peaceful and calm throughout the night."
13,CATEGORY 1 — ACCOMMODATION,English,Do the rooms have air conditioning?,"Yes, all rooms are equipped with air conditioning."
14,CATEGORY 1 — ACCOMMODATION,English,Is there backup electricity available?,"Yes, a standby power supply ensures uninterrupted electricity."
15,CATEGORY 1 — ACCOMMODATION,English,Do you offer traditional local meals?,"Yes, we have a menu with a variety of authentic local dishes."
16,CATEGORY 1 — ACCOMMODATION,English,What payment methods do you accept?,"We accept cash, bank transfers, and online payment options."
17,CATEGORY 1 — ACCOMMODATION,English,Are there wardrobes or storage facilities in the rooms?,"Yes, each room has a wardrobe and storage space for luggage."
18,CATEGORY 1 — ACCOMMODATION,English,Do you have a play area for children?,"Yes, a safe and supervised play area is available for children."
19,CATEGORY 1 — ACCOMMODATION,English,How do you welcome guests on arrival?,We warmly greet guests with a welcome drink and provide essential information about the stay.
20,CATEGORY 1 — ACCOMMODATION,English,What additional facilities are included in the rooms?,"A study table, chairs, and an information booklet about nearby attractions are provided."
21,CATEGORY 1 — ACCOMMODATION,English,How can guests reach the nearby market?,"The market can be reached easily by tuk-tuk, bus, or on foot."
22,CATEGORY 1 — ACCOMMODATION,English,Is night-time security available?,"Yes, security staff are present throughout the night."
23,CATEGORY 1 — ACCOMMODATION,English,Do the rooms have a telephone?,"Yes, local calling is available through the in-room phone."
24,CATEGORY 1 — ACCOMMODATION,English,How do you maintain cleanliness at the accommodation?,"We follow regular cleaning routines, change bedding frequently, and record sanitation checks."
25,CATEGORY 1 — ACCOMMODATION,English,Is there a safe for storing valuables?,"Yes, a secure safe is provided in each room."
26,CATEGORY 1 — ACCOMMODATION,English,Is the drinking water treated or purified?,"Yes, purified bottled water is provided for guests."
27,CATEGORY 1 — ACCOMMODATION,English,Can guests make tea or coffee in the room?,"Yes, a small set with a kettle, cups, and tea supplies is provided."
28,CATEGORY 1 — ACCOMMODATION,English,Do you provide medical assistance if a guest feels unwell?,"Yes, we offer basic first aid and can arrange transportation to a medical center."
29,CATEGORY 1 — ACCOMMODATION,English,Is there a table or workspace in the room?,"Yes, a small desk and chair are included for guests who wish to work."
30,CATEGORY 1 — ACCOMMODATION,English,How do you ensure a peaceful environment for guests?,"We maintain regular cleaning, manage noise levels, and monitor the surroundings."
31,CATEGORY 1 — ACCOMMODATION,English,What are the check-in and check-out times?,"Check-in is usually from 12:00 PM, and check-out is at 10:00 AM."
32,CATEGORY 1 — ACCOMMODATION,English,How much space is available for storing clothes?,Each room has a spacious wardrobe with shelves and hanging space.
33,CATEGORY 1 — ACCOMMODATION,English,Are restaurants or food stalls available nearby?,"Yes, there are several small eateries and fruit stalls close to the accommodation."
34,CATEGORY 1 — ACCOMMODATION,English,Are there any rules regarding smoking?,"Most rooms are non-smoking, but we provide a designated smoking area."
35,CATEGORY 1 — ACCOMMODATION,English,Can I change my room booking if needed?,"Yes, please inform us in advance, and we will assist with the changes."
36,CATEGORY 1 — ACCOMMODATION,English,Do you offer facilities for business travelers?,"Yes, we have a small meeting area and a quiet workspace."
37,CATEGORY 1 — ACCOMMODATION,English,Are there laundry facilities available?,"Yes, we provide washing, drying, and ironing services."
38,CATEGORY 1 — ACCOMMODATION,English,Do you decorate rooms with flowers or special items?,"Yes, we offer simple floral arrangements upon request."
39,CATEGORY 1 — ACCOMMODATION,English,How do you maintain quietness during nighttime?,We follow strict quiet-hours policies to ensure peaceful rest for all guests.
40,CATEGORY 1 — ACCOMMODATION,English,Are there rules to ensure safety inside the accommodation?,"Yes, guests are advised to follow safety instructions and respect security guidelines."
41,CATEGORY 1 — ACCOMMODATION,English,How can guests adjust the room lighting?,The room has adjustable switches to control the brightness.
42,CATEGORY 1 — ACCOMMODATION,English,Are heating or cooling devices provided?,"Yes, air conditioning and basic heating equipment are available."
43,CATEGORY 1 — ACCOMMODATION,English,Can I arrive late at night?,"Yes, late check-in is possible if you inform us in advance."
44,CATEGORY 1 — ACCOMMODATION,English,What should I do if there is a problem with the bathroom?,"Please inform the staff, and maintenance will assist you immediately."
45,CATEGORY 1 — ACCOMMODATION,English,How can I keep my belongings safe?,Use the in-room safe or hand valuables to our staff for secure storage.
46,CATEGORY 1 — ACCOMMODATION,English,Are basic toiletries provided?,"Yes, we provide soap, shampoo, towels, and essential items."
47,CATEGORY 1 — ACCOMMODATION,English,How is cleanliness maintained in the bathroom?,Bathrooms are cleaned daily using disinfectants.
48,CATEGORY 1 — ACCOMMODATION,English,Why is it important to follow accommodation safety rules?,"To ensure personal safety, protect property, and prevent accidents."
49,CATEGORY 1 — ACCOMMODATION,English,What instructions do you provide for solo travelers?,We advise them to share travel details with the staff and avoid unsafe areas at night.
50,CATEGORY 1 — ACCOMMODATION,English,What is the purpose of providing a calm environment for guests?,"To ensure relaxation, comfort, and a pleasant stay."
51,CATEGORY 2 — TRANSPORTATION,English,How do I buy a bus ticket in Sri Lanka?,You can purchase a ticket directly from the bus conductor after boarding.
52,CATEGORY 2 — TRANSPORTATION,English,How can I change buses during my journey?,You can get down at a main town or junction and ask for the connecting bus.
53,CATEGORY 2 — TRANSPORTATION,English,How should I board a crowded bus safely?,"Stand away from the door, wait for passengers to get off, and hold onto the railings."
54,CATEGORY 2 — TRANSPORTATION,English,What are the advantages of traveling by train?,"Trains are affordable, scenic, and often more comfortable than crowded buses."
55,CATEGORY 2 — TRANSPORTATION,English,What safety rules should I follow on a train?,"Avoid leaning out of the door, stand behind the yellow line, and follow station announcements."
56,CATEGORY 2 — TRANSPORTATION,English,How do I negotiate the fare for a tuk-tuk?,It is best to agree on the fare before starting the journey.
57,CATEGORY 2 — TRANSPORTATION,English,How can I ensure safety on intercity buses?,"Keep your belongings close, remain seated during the ride, and follow staff instructions."
58,CATEGORY 2 — TRANSPORTATION,English,How can I find the correct bus route?,Check signboards at bus stands or ask officials for guidance.
59,CATEGORY 2 — TRANSPORTATION,English,What should I do if I face a problem during the journey?,Ask for help from nearby passengers or inform the driver or conductor.
60,CATEGORY 2 — TRANSPORTATION,English,What is the best way to travel short distances in a city?,"Tuk-tuks, mini buses, and walking are convenient for short trips."
61,CATEGORY 2 — TRANSPORTATION,English,What details are required to buy a train ticket?,"You need to mention the destination, travel class, and desired departure time."
62,CATEGORY 2 — TRANSPORTATION,English,How can I identify bus stops along the route?,"Look for signboards, junction names, or ask the conductor for assistance."
63,CATEGORY 2 — TRANSPORTATION,English,How do I change trains during long trips?,Follow the station signs and confirm the platform number with railway staff.
64,CATEGORY 2 — TRANSPORTATION,English,How can foreign travelers find transport information easily?,They can ask at tourist help desks or inquire at major transport hubs.
65,CATEGORY 2 — TRANSPORTATION,English,How can I stay safe while walking on busy streets?,"Use pedestrian crossings, stay on the pavement, and avoid walking on the road."
66,CATEGORY 2 — TRANSPORTATION,English,How should I stand in a bus when seats are full?,Hold the overhead rails firmly and avoid standing near the door.
67,CATEGORY 2 — TRANSPORTATION,English,What tips do you recommend for night-time bus travel?,"Sit near the front, keep your valuables close, and stay alert during stops."
68,CATEGORY 2 — TRANSPORTATION,English,How can I identify the train’s reserved compartments?,Reserved sections are marked on the carriage and announced at the station.
69,CATEGORY 2 — TRANSPORTATION,English,How can I avoid distractions while driving or riding?,Avoid using mobile phones and keep full attention on the road.
70,CATEGORY 2 — TRANSPORTATION,English,Why is it important to ask locals for directions during travel?,They can provide accurate instructions about safe routes and bus connections.
71,CATEGORY 2 — TRANSPORTATION,English,How do I hire a taxi in Sri Lanka?,"You can use taxi apps, call a taxi service, or find one at designated stands."
72,CATEGORY 2 — TRANSPORTATION,English,Are airport taxi services available 24/7?,"Yes, taxi counters at the airport operate around the clock."
73,CATEGORY 2 — TRANSPORTATION,English,What is the safest way to cross roads in busy towns?,Use pedestrian crossings and wait for vehicles to stop before crossing.
74,CATEGORY 2 — TRANSPORTATION,English,How do I check train schedules?,"You can check at the station, refer to display boards, or ask railway staff."
75,CATEGORY 2 — TRANSPORTATION,English,Can I hire a motorbike for short trips?,"Yes, motorbikes are available for rent in many tourist areas."
76,CATEGORY 2 — TRANSPORTATION,English,What documents do I need to rent a vehicle?,A passport and a valid driving license are required.
77,CATEGORY 2 — TRANSPORTATION,English,How do I avoid losing my luggage while traveling?,"Keep your bags close, label them clearly, and avoid leaving them unattended."
78,CATEGORY 2 — TRANSPORTATION,English,Are long-distance buses comfortable?,"Yes, most long-distance buses have comfortable seating and air-conditioning."
79,CATEGORY 2 — TRANSPORTATION,English,How do I locate my platform at a railway station?,Follow the signs or ask officials at the information counter.
80,CATEGORY 2 — TRANSPORTATION,English,What is the benefit of using taxi apps?,"They provide transparent pricing, route tracking, and safe payment options."
81,CATEGORY 2 — TRANSPORTATION,English,Can I reserve train seats in advance?,"Yes, advance reservations are available for certain routes."
82,CATEGORY 2 — TRANSPORTATION,English,How do I identify the right bus at a busy terminal?,"Check the bus number, route board, and confirm with the conductor."
83,CATEGORY 2 — TRANSPORTATION,English,What is the best way to avoid traffic during peak hours?,"Travel early, use alternative routes, or choose public transport."
84,CATEGORY 2 — TRANSPORTATION,English,Are night trains available?,"Yes, some major routes operate night-time train services."
85,CATEGORY 2 — TRANSPORTATION,English,How can I ensure safety when using ride-sharing services?,"Verify the vehicle details, check the driver’s name, and share your trip status."
86,CATEGORY 2 — TRANSPORTATION,English,What should I do if a bus breaks down during the journey?,"Stay calm, follow the conductor’s instructions, and wait for a replacement bus."
87,CATEGORY 2 — TRANSPORTATION,English,Is it safe to use public transport late at night?,"It is safe in main cities, but avoid isolated stops and travel with caution."
88,CATEGORY 2 — TRANSPORTATION,English,How can I avoid getting overcharged by tuk-tuks?,Agree on the fare before starting or choose a metered tuk-tuk.
89,CATEGORY 2 — TRANSPORTATION,English,What should I do if I get lost during travel?,"Ask locals for help, check signboards, or call your accommodation for guidance."
90,CATEGORY 2 — TRANSPORTATION,English,Are buses frequent between major towns?,"Yes, many routes have buses running every 10–20 minutes."
91,CATEGORY 2 — TRANSPORTATION,English,What is the safest way to store valuables during travel?,Keep them in a secure bag and avoid displaying them in public.
92,CATEGORY 2 — TRANSPORTATION,English,How do I know if a bus is express or normal?,"Express buses display red or blue boards, while normal buses have standard white boards."
93,CATEGORY 2 — TRANSPORTATION,English,Are there special seats for elderly passengers?,"Yes, priority seats are reserved for the elderly, pregnant women, and disabled passengers."
94,CATEGORY 2 — TRANSPORTATION,English,How can I avoid motion sickness during long trips?,"Sit near the front, keep your eyes on the road, and avoid heavy meals."
95,CATEGORY 2 — TRANSPORTATION,English,Are train journeys safe for solo female travelers?,"Yes, but it is advisable to stay in well-lit areas and avoid isolated compartments."
96,CATEGORY 2 — TRANSPORTATION,English,How do I book long-distance bus tickets?,You can book them at bus stations or through travel agents.
97,CATEGORY 2 — TRANSPORTATION,English,What should I do if I miss my bus or train?,Go to the nearest counter and ask for the next available service.
98,CATEGORY 2 — TRANSPORTATION,English,Are there luggage limits on buses or trains?,Most passengers can carry moderate luggage; oversized bags may require extra charges.
99,CATEGORY 2 — TRANSPORTATION,English,How can I find the nearest taxi stand?,"Ask locals, check signboards, or use a map application."
100,CATEGORY 2 — TRANSPORTATION,English,What precautions should I take when traveling during heavy rain?,"Avoid flooded routes, wait in sheltered areas, and follow safety announcements."
101,CATEGORY 3 — TOURIST ATTRACTIONS,English,What are the most popular tourist attractions in Sri Lanka?,"Some of the most popular attractions include Sigiriya, Ella, Kandy, Galle Fort, and Yala National Park."
102,CATEGORY 3 — TOURIST ATTRACTIONS,English,How long does it take to climb Sigiriya Rock?,It usually takes about 1.5 to 2 hours depending on your pace.
103,CATEGORY 3 — TOURIST ATTRACTIONS,English,Is a guide necessary to explore Sigiriya?,"A guide is not required, but it helps you understand the history and cultural significance."
104,CATEGORY 3 — TOURIST ATTRACTIONS,English,What is special about the Temple of the Tooth in Kandy?,It houses a sacred relic believed to be a tooth of Lord Buddha.
105,CATEGORY 3 — TOURIST ATTRACTIONS,English,What is the best time to visit Ella?,The best time is from January to April when the weather is clear.
106,CATEGORY 3 — TOURIST ATTRACTIONS,English,Is there an entrance fee to visit national parks?,"Yes, all national parks require an entrance ticket and a wildlife guide or jeep."
107,CATEGORY 3 — TOURIST ATTRACTIONS,English,Can I visit ancient cities like Anuradhapura and Polonnaruwa in one day?,It is possible but better to spend at least a full day at each site to explore properly.
108,CATEGORY 3 — TOURIST ATTRACTIONS,English,What is special about the Galle Fort?,It is a UNESCO World Heritage Site built by the Portuguese and later expanded by the Dutch.
109,CATEGORY 3 — TOURIST ATTRACTIONS,English,What attractions are suitable for families with children?,"Beaches, botanical gardens, cultural shows, and safari parks are ideal for families."
110,CATEGORY 3 — TOURIST ATTRACTIONS,English,What are the main attractions in Colombo?,"Galle Face Green, Independence Square, Gangaramaya Temple, and the National Museum."
111,CATEGORY 3 — TOURIST ATTRACTIONS,English,Can tourists visit tea plantations?,"Yes, many tea estates in Nuwara Eliya and Ella offer guided tours and tastings."
112,CATEGORY 3 — TOURIST ATTRACTIONS,English,What is the best time to visit the southern beaches?,November to April is the ideal season for calm seas and good weather.
113,CATEGORY 3 — TOURIST ATTRACTIONS,English,Are there any waterfalls that tourists can safely visit?,"Yes, Ramboda Falls, Dunhinda Falls, and Ravana Falls are popular and safe for viewing."
114,CATEGORY 3 — TOURIST ATTRACTIONS,English,What makes Yala National Park famous?,It has one of the highest leopard densities in the world.
115,CATEGORY 3 — TOURIST ATTRACTIONS,English,Are there cultural festivals tourists can attend?,"Yes, major festivals include the Kandy Perahera, Vesak celebrations, and Poson festivals."
116,CATEGORY 3 — TOURIST ATTRACTIONS,English,Can I take photos inside temples?,Photography is usually allowed outside but restricted inside sacred areas.
117,CATEGORY 3 — TOURIST ATTRACTIONS,English,What is the best way to explore the Hill Country?,Train rides from Kandy to Ella are the most scenic and popular.
118,CATEGORY 3 — TOURIST ATTRACTIONS,English,Are boat rides available in Bentota?,"Yes, river safaris, lagoon boat tours, and water sports are available."
119,CATEGORY 3 — TOURIST ATTRACTIONS,English,What wildlife can I expect to see on a safari?,"Elephants, leopards, crocodiles, deer, monkeys, and a wide range of birds."
120,CATEGORY 3 — TOURIST ATTRACTIONS,English,Are there hiking trails for beginners?,"Yes, trails like Mini Adam’s Peak and Horton Plains are suitable for beginners."
121,CATEGORY 3 — TOURIST ATTRACTIONS,English,Can tourists visit traditional villages?,"Yes, many cultural villages offer demonstrations of traditional crafts and lifestyles."
122,CATEGORY 3 — TOURIST ATTRACTIONS,English,What is special about the Nine Arch Bridge?,It is a historic railway bridge known for its beautiful architecture and lush surroundings.
123,CATEGORY 3 — TOURIST ATTRACTIONS,English,Can I swim at all beaches in Sri Lanka?,"No, some beaches have strong currents; always check safety flags."
124,CATEGORY 3 — TOURIST ATTRACTIONS,English,Which place is best for whale watching?,Mirissa is one of the best locations for whale watching.
125,CATEGORY 3 — TOURIST ATTRACTIONS,English,Are safari parks safe for children?,"Yes, as long as they remain inside the vehicle and follow safety instructions."
126,CATEGORY 3 — TOURIST ATTRACTIONS,English,Are there any free tourist attractions?,"Yes, public parks, beaches, and many religious sites are free to enter."
127,CATEGORY 3 — TOURIST ATTRACTIONS,English,What are the best places for sunsets in Sri Lanka?,"Galle Face, Mirissa, Trincomalee beaches, and Ella Gap offer stunning sunsets."
128,CATEGORY 3 — TOURIST ATTRACTIONS,English,What is unique about Horton Plains?,"It features World’s End, Baker’s Falls, and a rare highland ecosystem."
129,CATEGORY 3 — TOURIST ATTRACTIONS,English,What clothing is recommended for visiting temples?,Modest clothing covering shoulders and knees is required.
130,CATEGORY 3 — TOURIST ATTRACTIONS,English,Are there turtle hatcheries tourists can visit?,"Yes, several hatcheries in the south allow visitors to learn about turtle conservation."
131,CATEGORY 3 — TOURIST ATTRACTIONS,English,Which areas are good for scuba diving or snorkeling?,"Hikkaduwa, Trincomalee, and Kalpitiya are popular for underwater activities."
132,CATEGORY 3 — TOURIST ATTRACTIONS,English,Is Adam’s Peak difficult to climb?,It is challenging but manageable for most visitors with frequent resting points.
133,CATEGORY 3 — TOURIST ATTRACTIONS,English,Where can I see elephants in the wild?,"Minneriya, Udawalawe, and Yala National Parks are excellent for wild elephant sightings."
134,CATEGORY 3 — TOURIST ATTRACTIONS,English,What is special about Nuwara Eliya?,"It is known as “Little England” due to its cool climate, tea plantations, and colonial-era buildings."
135,CATEGORY 3 — TOURIST ATTRACTIONS,English,Are there any museums worth visiting?,"Yes, the National Museum, Colombo Planetarium, and Maritime Museum in Galle."
136,CATEGORY 3 — TOURIST ATTRACTIONS,English,Can tourists visit sacred Buddhist sites?,"Yes, but visitors must dress modestly and behave respectfully."
137,CATEGORY 3 — TOURIST ATTRACTIONS,English,What is unique about Trincomalee?,"Its beautiful beaches, colorful temples, and natural harbor make it unique."
138,CATEGORY 3 — TOURIST ATTRACTIONS,English,Are there any eco-tourism destinations?,"Yes, Sinharaja Forest, Knuckles Range, and Wasgamuwa are popular eco-tourism areas."
139,CATEGORY 3 — TOURIST ATTRACTIONS,English,How can I learn about Sri Lankan history?,"Visiting ancient cities, museums, and UNESCO heritage sites offers deep historical insight."
140,CATEGORY 3 — TOURIST ATTRACTIONS,English,Are cultural shows available for tourists?,"Yes, many cultural dance shows and music performances are available in Kandy and Colombo."
141,CATEGORY 3 — TOURIST ATTRACTIONS,English,What is the best time to visit the Cultural Triangle?,The ideal time is from May to September when rainfall is low.
142,CATEGORY 3 — TOURIST ATTRACTIONS,English,Which places are ideal for photography lovers?,"Ella, Sigiriya, Galle Fort, tea plantations, and wildlife parks offer great photo locations."
143,CATEGORY 3 — TOURIST ATTRACTIONS,English,Are there any religious festivals open to tourists?,"Yes, Esala Perahera and Vesak celebrations are open to everyone."
144,CATEGORY 3 — TOURIST ATTRACTIONS,English,Can tourists explore caves in Sri Lanka?,"Yes, Dambulla Cave Temple and Batadombalena are popular cave sites."
145,CATEGORY 3 — TOURIST ATTRACTIONS,English,What is special about Mirissa?,"It is famous for whale watching, clean beaches, and relaxing coastal views."
146,CATEGORY 3 — TOURIST ATTRACTIONS,English,What should I know before hiking in Sri Lanka?,"Carry water, wear proper shoes, and follow marked trails for safety."
147,CATEGORY 3 — TOURIST ATTRACTIONS,English,Are there any botanical gardens to visit?,"Yes, Peradeniya and Hakgala Botanical Gardens are famous for their plant diversity."
148,CATEGORY 3 — TOURIST ATTRACTIONS,English,Which attractions are good for birdwatching?,Kumana National Park and Bundala Sanctuary are ideal for birdwatching.
149,CATEGORY 3 — TOURIST ATTRACTIONS,English,Can I visit local markets and bazaars?,"Yes, most towns have lively markets with fresh produce, crafts, and local snacks."
150,CATEGORY 3 — TOURIST ATTRACTIONS,English,What is special about Sri Lanka’s beaches?,"They offer warm waters, golden sand, and a variety of activities like swimming, surfing, and relaxing."
151,CATEGORY 4 — FOOD & CULTURE,English,What are the most popular traditional foods in Sri Lanka?,"Some popular dishes include rice and curry, hoppers, kottu, pittu, and string hoppers."
152,CATEGORY 4 — FOOD & CULTURE,English,What is the national dish of Sri Lanka?,Rice and curry is considered the national meal of Sri Lanka.
153,CATEGORY 4 — FOOD & CULTURE,English,What time do Sri Lankans usually eat lunch?,Many locals eat lunch between 12:00 PM and 2:00 PM.
154,CATEGORY 4 — FOOD & CULTURE,English,Is Sri Lankan food spicy?,"Yes, many dishes are spicy, but mild options are also available."
155,CATEGORY 4 — FOOD & CULTURE,English,What type of rice is commonly eaten in Sri Lanka?,"Red rice, white rice, and short-grain rice are used in daily meals."
156,CATEGORY 4 — FOOD & CULTURE,English,What is a traditional Sri Lankan breakfast?,"String hoppers, pittu, and milk rice are common breakfast items."
157,CATEGORY 4 — FOOD & CULTURE,English,What are the main ingredients in Sri Lankan curries?,"Coconut milk, spices, onions, garlic, ginger, and curry leaves are commonly used."
158,CATEGORY 4 — FOOD & CULTURE,English,Where can tourists taste authentic Sri Lankan food?,"Local restaurants, village homes, and small food stalls offer authentic dishes."
159,CATEGORY 4 — FOOD & CULTURE,English,What are some safe street foods for tourists?,"Hoppers, roti, samosas, and fresh fruit cups are usually safe to try."
160,CATEGORY 4 — FOOD & CULTURE,English,What is milk rice (kiribath)?,"Milk rice is a dish made by cooking rice with coconut milk, served on special occasions."
